{
  "$schema": "../schemas/legal-source-pack-v1.schema.json",
  "schemaVersion": 1,
  "packId": "us-federal-ma-employment-separation",
  "version": "1.0.0",
  "title": "United States federal and Massachusetts employment-separation baseline",
  "notice": "This curated public-source inventory supports research routing only. It does not determine coverage, controlling law, deadlines, enforceability, remedies, or advice for any person, document, or dispute.",
  "baseline": {
    "scope": "A deliberately bounded starting set for private-sector employment-separation research involving United States federal and Massachusetts sources; public employment, collective bargaining, local law, industry-specific rules, case-law treatment, and comprehensive benefits coverage remain outside version 1.",
    "jurisdictionIds": [
      "us-federal",
      "us-ma"
    ],
    "subjects": [
      "benefits",
      "discrimination",
      "filing-and-deadlines",
      "leave",
      "personnel-records",
      "release-and-waiver",
      "unemployment",
      "wage-and-payment"
    ],
    "observedAt": "2026-09-04T23:00:00Z",
    "comparativeClaims": false,
    "applicability": {
      "status": "not-determined",
      "rule": "Inclusion identifies a public research starting point only. Jurisdiction, geography, subject tags, source authority, and packet presence do not establish that a source applies to a person, agreement, employer, event, or remedy."
    }
  },
  "sources": [
    {
      "id": "federal-dol-cobra",
      "name": "Continuation of Health Coverage (COBRA)",
      "jurisdictionId": "us-federal",
      "subjects": [
        "benefits"
      ],
      "materialType": "agency-guidance",
      "authorityStatus": "official-guidance",
      "issuingBody": "Employee Benefits Security Administration",
      "publisher": "United States Department of Labor",
      "canonicalUrl": "https://www.dol.gov/general/topic/health-plans/cobra",
      "rights": {
        "status": "public-domain-with-exceptions",
        "termsUrl": "https://www.dol.gov/general/aboutdol/copyright",
        "redistribution": "review-required",
        "quotation": "review-required",
        "notes": "Department-created material is generally public domain, but third-party and protected marks or media require source-specific review."
      },
      "dates": {
        "publication": { "status": "unknown", "value": null },
        "effective": { "status": "not-applicable", "value": null },
        "currentThrough": { "status": "unknown", "value": null },
        "observed": "2026-09-04",
        "reviewDue": "2026-10-04"
      },
      "currentnessStatus": "unknown",
      "availability": "available",
      "supersededBy": null,
      "inclusionRationale": "Official federal benefits guidance provides a separation-related continuation-coverage starting point without replacing plan notices or statutory review.",
      "limitations": [
        "Coverage, qualifying events, plan type, election periods, and notices require fact-specific verification.",
        "The page is guidance rather than the legal edition of a statute or regulation."
      ],
      "metadataReview": {
        "status": "reviewed",
        "reviewer": "akashic-source-review",
        "reviewedAt": "2026-09-04T23:00:00Z",
        "humanStatus": "pending"
      },
      "integrity": {
        "recordSha256": "9523563fbc0cd727033bf026b33aba4101f690171b8d7250e1d527771ab74c1d",
        "snapshot": {
          "status": "metadata-only",
          "manifestPath": null,
          "snapshotId": null,
          "normalizedArtifactPath": null,
          "sha256": null,
          "note": "No immutable page bytes are checked in; refresh must re-review the official page and its current authority."
        }
      }
    },
    {
      "id": "federal-dol-termination",
      "name": "Termination",
      "jurisdictionId": "us-federal",
      "subjects": [
        "benefits",
        "filing-and-deadlines",
        "leave",
        "unemployment",
        "wage-and-payment"
      ],
      "materialType": "topic-guide",
      "authorityStatus": "official-self-help",
      "issuingBody": "United States Department of Labor",
      "publisher": "United States Department of Labor",
      "canonicalUrl": "https://www.dol.gov/general/topic/termination",
      "rights": {
        "status": "public-domain-with-exceptions",
        "termsUrl": "https://www.dol.gov/general/aboutdol/copyright",
        "redistribution": "review-required",
        "quotation": "review-required",
        "notes": "Department-created material is generally public domain, with source-specific exceptions for third-party material and protected identifiers."
      },
      "dates": {
        "publication": { "status": "unknown", "value": null },
        "effective": { "status": "not-applicable", "value": null },
        "currentThrough": { "status": "unknown", "value": null },
        "observed": "2026-09-04",
        "reviewDue": "2026-10-04"
      },
      "currentnessStatus": "mixed",
      "availability": "available",
      "supersededBy": null,
      "inclusionRationale": "Official cross-topic routing connects termination research to federal wage, leave, unemployment, and benefit starting points.",
      "limitations": [
        "The topic page does not establish that a federal statute covers a particular worker or separation.",
        "State law and contract terms may differ and remain independently reviewable."
      ],
      "metadataReview": {
        "status": "reviewed",
        "reviewer": "akashic-source-review",
        "reviewedAt": "2026-09-04T23:00:00Z",
        "humanStatus": "pending"
      },
      "integrity": {
        "recordSha256": "83b0f9f3f6ce912b1853098c2410ec566ff743c30148e5579e2c43dc9ae9ed3e",
        "snapshot": {
          "status": "metadata-only",
          "manifestPath": null,
          "snapshotId": null,
          "normalizedArtifactPath": null,
          "sha256": null,
          "note": "No immutable page bytes are checked in; the topic routing must be re-observed during refresh."
        }
      }
    },
    {
      "id": "federal-eeoc-charge",
      "name": "Filing a Charge of Discrimination",
      "jurisdictionId": "us-federal",
      "subjects": [
        "discrimination",
        "filing-and-deadlines"
      ],
      "materialType": "filing-pathway",
      "authorityStatus": "official-service-or-form",
      "issuingBody": "United States Equal Employment Opportunity Commission",
      "publisher": "United States Equal Employment Opportunity Commission",
      "canonicalUrl": "https://www.eeoc.gov/filing-charge-discrimination",
      "rights": {
        "status": "public-domain-with-exceptions",
        "termsUrl": null,
        "redistribution": "review-required",
        "quotation": "review-required",
        "notes": "Federal agency-authored material is generally public domain, but this record makes no blanket claim for embedded or linked third-party content."
      },
      "dates": {
        "publication": { "status": "unknown", "value": null },
        "effective": { "status": "not-applicable", "value": null },
        "currentThrough": { "status": "unknown", "value": null },
        "observed": "2026-09-04",
        "reviewDue": "2026-10-04"
      },
      "currentnessStatus": "current",
      "availability": "available",
      "supersededBy": null,
      "inclusionRationale": "The official charge pathway makes federal and state or local dual-filing, deadline, and federal-employee distinctions visible.",
      "limitations": [
        "The pathway does not decide coverage, timeliness, merits, or whether another filing is required.",
        "Federal employees and applicants use a different process."
      ],
      "metadataReview": {
        "status": "reviewed",
        "reviewer": "akashic-source-review",
        "reviewedAt": "2026-09-04T23:00:00Z",
        "humanStatus": "pending"
      },
      "integrity": {
        "recordSha256": "4a887a42066eaccfd888b9693a82d9d978859deecafee9f460c9a5f30245ec71",
        "snapshot": {
          "status": "metadata-only",
          "manifestPath": null,
          "snapshotId": null,
          "normalizedArtifactPath": null,
          "sha256": null,
          "note": "The service page is not captured; users must verify the live process and notices before use."
        }
      }
    },
    {
      "id": "federal-eeoc-forms",
      "name": "Selected EEOC Forms",
      "jurisdictionId": "us-federal",
      "subjects": [
        "discrimination",
        "filing-and-deadlines"
      ],
      "materialType": "official-form",
      "authorityStatus": "official-service-or-form",
      "issuingBody": "United States Equal Employment Opportunity Commission",
      "publisher": "United States Equal Employment Opportunity Commission",
      "canonicalUrl": "https://www.eeoc.gov/selected-eeoc-forms",
      "rights": {
        "status": "public-domain-with-exceptions",
        "termsUrl": null,
        "redistribution": "review-required",
        "quotation": "review-required",
        "notes": "Federal agency-authored forms are generally public domain, but current edition, embedded material, accessibility, and submission instructions require form-specific review."
      },
      "dates": {
        "publication": { "status": "unknown", "value": null },
        "effective": { "status": "not-applicable", "value": null },
        "currentThrough": { "status": "unknown", "value": null },
        "observed": "2026-09-04",
        "reviewDue": "2026-10-04"
      },
      "currentnessStatus": "unknown",
      "availability": "available",
      "supersededBy": null,
      "inclusionRationale": "The official form index keeps Form 5 and related charge documents distinct from the EEOC filing guidance and private portal session.",
      "limitations": [
        "A listed form may not be the correct or accepted filing route for every charge or jurisdiction.",